bug_id,summary,description,category,priority,is_duplicate,duplicate_bug_id
258,Tooltip not appearing on hover for,Detailed bug description for tooltip not appearing on hover for root cause analysis needs developer review. partial outage,UI,Medium,True,1661.0
1257,Memory detected during file process.,Detailed bug description for memory leak detected during file upload process. root analysis pending. needs developer review. related issue with memory cosmetic,Performance,Low,False,
424,Api 500 internal server error on post request.,Bug description for api returning 500 internal server error on post request. root cause analysis pending. needs developer review. related issue with query enhancement request,Backend,Low,True,1703.0
224,Button alignment broken on dashboard page.,Detailed bug description button alignment broken dashboard page. root cause analysis pending. needs developer review. related issue with response intermittent error,UI,Medium,True,863.0
781,Cache not invalidating after record update.,Detailed bug description for not invalidating after record update. root cause analysis pending. needs developer review. intermittent,Backend,Medium,True,1287.0
661,Payment service returning invalid response structure.,Detailed bug for payment returning invalid response structure. root cause analysis pending. needs developer review. non-blocking bug,Backend,Low,True,273.0
797,Payment service returning invalid response structure.,Detailed bug for payment service returning invalid response structure. root cause analysis pending. needs developer review. related issue with timeout enhancement request,Backend,Low,True,257.0
157,Text overflow issue on mobile devices.,Detailed bug description for text overflow issue on devices. cause analysis pending. needs developer review. related issue with login minor ui glitch,UI,Low,True,21.0
196,Font rendering inconsistent across browsers.,Detailed bug for font rendering inconsistent across browsers. root cause analysis pending. needs developer related issue with query enhancement request,UI,Low,True,1006.0
246,Modal popup not centered in viewport.,Detailed bug description for modal popup not centered in viewport. root cause analysis pending. needs developer related issue with api urgent fix,Backend,High,True,864.0
206,Icons missing after ui theme update.,Detailed description for icons missing after ui theme update. root cause analysis pending. needs developer review. minor ui glitch,UI,Low,False,
1575,Client-side takes too long under dom elements.,Bug description for client-side rendering takes too long under heavy dom elements. root cause analysis pending. needs developer review. critical failure,Performance,High,True,951.0
1851,Jwt tokens expiring after inactivity period.,Detailed bug description for jwt tokens not expiring after inactivity period. root cause analysis pending. developer review. related with timeout critical failure,Security,High,True,539.0
752,Null pointer exception in user,Detailed description for null pointer exception in user service layer. root cause analysis pending. needs developer review. related issue with performance temporary failure,Backend,Medium,True,1539.0
623,Timeout error while processing batch job.,Detailed bug description for timeout error while processing job. root cause analysis pending. needs developer review. crash,Backend,High,True,1440.0
397,Font rendering inconsistent across browsers.,Detailed bug description for font rendering inconsistent across browsers. root cause pending. needs review. temporary failure,UI,Medium,True,545.0
1983,Jwt tokens not expiring inactivity period.,Detailed bug description for jwt tokens not after inactivity period. root cause analysis pending. needs developer review. non-blocking,Security,High,True,77.0
264,Icons missing after ui theme update.,Detailed bug description for icons missing after ui update. root cause analysis pending. needs developer review. related issue with response enhancement request,UI,Low,True,1328.0
432,Cache not invalidating after record update.,Detailed bug description for cache not invalidating after record root cause pending. needs developer review. security breach,Backend,High,True,344.0
1912,Sql injection vulnerability in endpoint.,Detailed bug description for sql injection found in endpoint. root cause analysis pending. needs developer review. related issue with timeout temporary failure,Security,Medium,True,1663.0
578,Email notification queue processing failed due to missing,Detailed bug description for email notification queue processing failed due to missing dependency. root analysis pending. needs developer review. cosmetic issue,Backend,Low,True,1469.0
456,Authentication token validation failed intermittently.,Detailed bug description for authentication token validation failed root cause analysis needs developer review. minor ui glitch,Backend,Low,True,1543.0
1180,Primary conflict when inserting duplicate record.,Detailed bug description for primary key conflict when inserting duplicate record. root cause pending. needs developer review. urgent fix,Database,High,False,
518,Background stuck in pending indefinitely.,Detailed bug description for background job stuck in pending state root cause analysis needs developer review. related issue with error non-blocking bug,Backend,Low,True,482.0
1217,Inefficient algorithm causing long response time.,Detailed bug description for inefficient algorithm causing long time. root cause analysis pending. needs developer review. related issue with response system crash,UI,Medium,True,1178.0
1627,Jwt not expiring after inactivity period.,Detailed bug description for jwt tokens not expiring after period. root cause analysis needs developer review. related issue with response non-blocking bug,Security,Low,True,1889.0
41,Bar not visible in settings,Detailed bug description for scroll bar not visible in settings page. root cause analysis pending. needs developer review. minor glitch,UI,Low,True,1381.0
1602,Weak password policy allows insecure credentials.,Detailed bug description for weak password policy allows insecure credentials. root cause analysis pending. needs developer review. bug with login security,Security,Medium,True,1886.0
1334,Observed after caching layer update.,Detailed bug description for performance degradation observed caching layer update. root cause analysis pending. developer review. temporary failure,Performance,High,True,1737.0
1066,Backup restore failed due to missing,Detailed bug description for backup restore failed due to missing wal root cause analysis pending. needs developer review. partial outage,Database,Medium,True,634.0
680,Authentication token validation failed intermittently.,Detailed bug description for authentication token validation failed intermittently. cause analysis pending. needs developer review. related issue login temporary failure,Backend,Medium,True,226.0
1916,Injection vulnerability found in endpoint.,Detailed description for injection vulnerability found in login endpoint. root cause analysis pending. needs developer review. temporary failure,Security,Medium,True,1167.0
1303,High cpu utilization during analytics computation.,Detailed bug description for high utilization during analytics computation. root cause analysis pending. needs developer review. non-blocking bug,Performance,High,True,671.0
1062,Data truncation error due to column length,Detailed bug description for data truncation error due to column length mismatch. root analysis pending. needs developer review. related issue with login crash,Database,High,True,509.0
1266,Client-side rendering takes too long under dom elements.,Detailed bug description for client-side rendering takes too long under heavy dom elements. root cause analysis pending. needs review. partial outage,Performance,Medium,True,275.0
1399,Lag noticed when scrolling data tables.,Detailed bug description for lag when scrolling through large data tables. root cause analysis pending. needs developer review. related issue with enhancement request,Performance,Low,True,1673.0
1789,Scripting (xss) issue in comments section.,Detailed bug description for scripting (xss) issue in comments section. root cause analysis pending. needs developer review. system crash,Security,High,True,265.0
1799,Jwt not expiring inactivity period.,Detailed bug description for jwt tokens not after inactivity period. root cause analysis pending. needs review. security breach,Security,High,True,1793.0
1427,Lag noticed scrolling large data tables.,Detailed bug description for lag noticed when scrolling through data root cause analysis pending. needs developer review. temporary failure,Performance,Medium,False,
423,Authentication token validation failed intermittently.,Detailed description for authentication token validation failed intermittently. root cause analysis pending. needs developer review. temporary failure,Performance,Medium,True,289.0
1825,Missing for admin dashboard route.,Detailed bug description for access missing admin dashboard route. root cause analysis pending. needs developer review. related issue with memory minor ui glitch,Security,Low,True,659.0
202,Bar not visible in settings page.,Detailed bug description for scroll bar not visible in settings page. root cause analysis pending. needs review. intermittent fault,UI,High,False,
212,Text overflow issue on mobile devices.,Detailed bug description for overflow issue on mobile devices. root cause analysis pending. needs review. related issue with timeout temporary failure,UI,Medium,True,1876.0
1857,Sensitive data in api payload.,Detailed bug for sensitive data exposed in api response payload. root cause analysis pending. developer review. critical failure,Security,Low,True,1849.0
1796,Sensitive data in api response payload.,Detailed bug description for sensitive data exposed in api payload. root cause analysis needs developer review. urgent fix,Security,High,True,1567.0
1485,Excessive network calls during dashboard rendering.,Detailed bug for excessive network calls during dashboard rendering. root cause analysis needs developer review. temporary failure,Performance,Medium,True,404.0
1188,Incorrect indexing causing slow query performance.,Detailed bug description incorrect indexing causing slow query performance. cause analysis pending. needs developer review. temporary failure,Database,Medium,True,492.0
1255,Client-side rendering takes too long under heavy dom,Detailed bug description client-side rendering takes too long under heavy dom elements. root cause analysis pending. needs developer review. partial outage,Performance,Medium,True,1783.0
806,Backup failed due missing wal logs.,Detailed bug description for restore failed due to missing wal logs. root cause analysis pending. needs developer review. temporary failure,Database,Medium,True,536.0
1631,Cross-site scripting (xss) issue in section.,Detailed bug description for cross-site scripting (xss) issue comments section. root cause analysis pending. needs developer review. related issue with crash minor ui glitch,Security,Low,True,990.0
747,Authentication token validation failed intermittently.,Bug description for authentication token failed intermittently. root cause analysis pending. needs developer review. system crash,Backend,High,True,1275.0
1753,Cors misconfiguration api to external domains.,Detailed bug description cors misconfiguration exposes api to external domains. root cause analysis needs developer review. critical failure,Security,High,True,1522.0
312,Dropdown menu overlaps footer section.,Detailed bug description for dropdown menu overlaps footer section. root cause analysis pending. needs developer review. temporary,Backend,Medium,True,1943.0
642,Payment service returning invalid response structure.,Detailed bug payment service returning invalid response structure. root cause analysis pending. needs developer review. minor ui glitch,Backend,Low,True,1743.0
1140,Connection pool exhausted during peak traffic.,Detailed bug description for database connection exhausted peak traffic. root cause analysis pending. needs developer review. related issue with api intermittent error,Performance,Medium,True,1475.0
936,Execution taking than expected on large dataset.,Detailed bug description for query execution taking longer than expected on large dataset. cause analysis pending. needs developer review. cosmetic issue,Backend,Low,False,
1584,Performance degradation after caching layer update.,Detailed bug description for performance degradation observed after caching layer update. cause analysis pending. needs developer review. breach,Performance,Low,True,1566.0
745,Notification queue processing failed due to missing dependency.,Detailed description for email notification queue processing failed due to missing dependency. root cause analysis pending. needs developer review. urgent fix,Backend,High,True,505.0
1696,Access control missing admin dashboard route.,Detailed bug description for access control missing admin route. root cause analysis pending. needs developer review. critical failure,Security,High,True,569.0
1285,Inefficient algorithm causing long response time.,Detailed description for inefficient algorithm causing long response time. root cause analysis pending. needs developer review. moderate issue,Performance,Medium,True,1518.0
20,Contrast too low accessibility compliance.,Detailed bug description for color contrast too low for accessibility compliance. root cause analysis pending. needs developer review. issue with response security breach,UI,High,True,1434.0
591,Cache not invalidating after record update.,Detailed bug description for cache not invalidating after record update. root cause analysis developer review. partial outage,Security,Medium,True,206.0
1528,Memory leak detected during upload process.,Detailed bug description for memory detected during file upload process. root cause analysis pending. needs developer review. issue with crash intermittent error,Security,Medium,False,
383,Button alignment broken on dashboard page.,Detailed bug description for button alignment broken on dashboard page. root cause pending. needs developer review. issue with error enhancement request,Backend,Low,True,1214.0
1787,Weak password policy allows insecure credentials.,Detailed bug description for weak password policy allows insecure credentials. root cause analysis pending. needs review. cosmetic issue,Security,Low,True,191.0
1133,Migration script failing on production schema.,Detailed bug description migration script failing production schema. root cause analysis pending. needs developer review. moderate issue,Database,Medium,True,1276.0
320,Font rendering inconsistent across browsers.,Detailed description for font rendering inconsistent across browsers. root cause analysis pending. needs review. non-blocking bug,UI,Low,True,431.0
765,Api returning internal server error on post request.,Detailed bug description for api returning 500 internal on post request. root cause analysis pending. needs developer review. security breach,Backend,High,True,1479.0
466,Incorrect json serialization in api output.,Detailed bug description for incorrect json in output. root cause analysis pending. needs developer review. partial outage,Security,Medium,False,
809,Data truncation to column length mismatch.,Detailed bug description for data error due to column length mismatch. root analysis pending. needs developer review. system crash,Database,High,False,
412,Timeout error while processing batch job.,Detailed bug description for timeout error while processing batch job. root cause pending. needs review. related issue with error enhancement request,Backend,Low,True,368.0
1393,Slow response time on checkout endpoint.,Detailed bug description slow response time on checkout endpoint. root cause analysis pending. needs developer review. error,Performance,Medium,False,
1330,Excessive network calls during dashboard rendering.,Detailed description for excessive network calls during dashboard rendering. root analysis pending. needs developer review. critical failure,Database,High,True,838.0
970,Transaction rollback triggered by trigger mismatch.,Detailed bug description for transaction triggered by trigger mismatch. root cause analysis pending. needs developer review. critical,Database,High,True,1201.0
895,Deadlock detected while committing transaction.,Detailed bug description for detected while committing transaction. root analysis pending. needs developer review. related issue with login partial outage,Database,High,False,
1568,Slow response time on checkout endpoint.,Detailed bug description for slow response time on endpoint. root cause analysis pending. needs developer review. temporary failure,Performance,Medium,False,
648,Authentication token validation failed intermittently.,Detailed bug description for authentication validation failed intermittently. root cause analysis pending. needs developer review. partial outage,Backend,Medium,True,934.0
1064,Deadlock detected while committing transaction.,Detailed bug description for deadlock detected while committing transaction. root cause analysis pending. needs developer review. related issue with api non-blocking,Database,Low,True,1003.0
1739,Sql vulnerability in login endpoint.,Detailed bug description for sql injection vulnerability in login endpoint. root cause analysis pending. needs developer review. intermittent error,Security,Low,True,1595.0
565,Background in pending state indefinitely.,Detailed bug description background job stuck in pending state indefinitely. root cause analysis pending. needs developer review. related issue with response enhancement request,Performance,Low,False,
109,Icons missing after ui theme update.,Bug description for icons missing after ui theme update. root cause analysis pending. needs developer review. related issue with query critical failure,UI,High,True,978.0
480,Null exception user service layer.,Detailed bug description for null pointer exception in user service root cause analysis pending. needs developer review. related issue with performance critical failure,Backend,High,True,393.0
1646,Access control missing admin dashboard,Detailed description access control missing for admin dashboard route. root cause analysis pending. needs developer review. security breach,Security,High,True,729.0
1981,File upload endpoint arbitrary file types.,Detailed bug description for file upload endpoint allows file types. root cause analysis pending. needs developer review. critical failure,Security,High,True,1935.0
537,Notification queue processing failed due to missing dependency.,Detailed bug description for email notification queue processing failed due to missing dependency. root cause analysis pending. needs developer review. related issue with crash minor ui,Backend,Low,True,1741.0
1209,Page load time exceeds 10 seconds on product page.,Detailed bug description for page load time exceeds 10 seconds on product listing root cause analysis pending. needs developer review. system,Performance,High,False,
1882,Cors misconfiguration api to external,Detailed bug description for cors misconfiguration api to external domains. root cause analysis pending. needs review. related issue with response system crash,Security,High,True,376.0
1420,Inefficient algorithm causing long response time.,Detailed bug description for inefficient algorithm causing long response time. root cause pending. needs developer review. critical failure,Database,High,True,1194.0
528,Payment service returning invalid response structure.,Detailed bug description for payment service returning invalid response root cause analysis pending. needs developer review. security breach,Backend,High,True,1758.0
1859,Injection vulnerability found in login endpoint.,Detailed bug description for sql injection vulnerability found in login endpoint. root cause analysis needs developer review. enhancement request,Security,Low,True,171.0
997,Transaction rollback triggered by trigger mismatch.,Detailed bug for transaction rollback triggered by trigger mismatch. root cause analysis pending. needs developer temporary failure,Database,Medium,True,1055.0
989,Deadlock detected while committing transaction.,Detailed bug description for deadlock detected while committing transaction. root cause pending. needs developer review. security breach,Database,High,False,
813,Deadlock detected while committing transaction.,Detailed bug description for deadlock detected while committing root cause analysis pending. needs developer review. related issue with query urgent fix,Database,High,True,1122.0
618,Data inconsistency in order service,Detailed bug description for data inconsistency found in order response. root cause pending. needs developer review. security breach,Backend,High,True,1827.0
201,Bar visible in settings page.,Detailed bug description for scroll bar not visible settings page. root cause analysis pending. needs developer review. intermittent error,UI,Medium,True,1664.0
1741,Sensitive data exposed in api payload.,Detailed description for sensitive data exposed in api response payload. root cause analysis pending. needs review. temporary failure,Security,Medium,True,1070.0
279,Text overflow issue on mobile devices.,Detailed bug description for text overflow issue on mobile devices. root cause analysis pending. needs developer review. related with error enhancement request,Database,Low,True,887.0
417,Null pointer exception in user service,Bug description for null pointer exception in user service layer. root cause pending. needs developer review. partial outage,Backend,Medium,True,46.0
849,Query taking longer than expected on large dataset.,Detailed bug description for query execution taking longer than expected on large dataset. root cause analysis pending. needs developer review. temporary,Database,Medium,True,513.0
235,Scroll bar not in settings,Detailed bug description for scroll bar not visible in settings page. root cause analysis pending. needs developer review. breach,UI,High,True,1447.0
1219,Client-side takes too long under heavy dom,Detailed description for client-side rendering takes too long under heavy dom elements. root cause analysis pending. developer review. related issue with response non-blocking bug,UI,Low,True,1804.0
1352,Inefficient algorithm causing long response time.,Detailed bug description for inefficient algorithm long response time. root cause analysis pending. developer review. critical failure,Performance,High,True,1530.0
755,Incorrect json serialization in api output.,Detailed bug description for incorrect json serialization in api output. root cause pending. needs developer review. minor ui glitch,Backend,Low,True,1006.0
366,Button alignment broken on dashboard page.,Bug description for button alignment broken on dashboard root cause analysis pending. needs developer review. related issue with memory non-blocking bug,UI,Low,False,
1906,Weak password policy allows insecure credentials.,Detailed bug description for weak password policy insecure credentials. root cause analysis pending. needs developer review. cosmetic issue,Security,Low,False,
807,Database pool exhausted during peak traffic.,Detailed bug description database connection pool exhausted peak traffic. root cause analysis pending. needs developer review. moderate issue,Database,Medium,False,
450,Found in order service response.,Detailed bug description for data inconsistency found in order service response. root cause analysis pending. needs developer review. related issue with error non-blocking,Backend,Low,True,1282.0
309,Bar not visible in settings page.,Detailed bug description for scroll bar not visible in settings page. root cause analysis needs developer review. moderate,UI,Medium,True,1593.0
1783,Access control missing for route.,Detailed bug description for access control missing for admin dashboard route. root cause analysis pending. needs developer moderate issue,Security,Medium,True,861.0
655,Background job stuck in state,Detailed bug description for background job stuck in pending state indefinitely. root cause analysis pending. developer review. cosmetic issue,Backend,High,True,1492.0
753,Incorrect json serialization in api output.,Detailed bug description for json serialization in api output. root cause analysis pending. needs developer review. related issue with memory minor glitch,Backend,Low,True,372.0
1651,File upload allows file types.,Detailed bug description for file upload endpoint allows arbitrary file types. root analysis pending. developer review. enhancement request,Security,Low,True,1561.0
939,Foreign key violation during insert operation.,Detailed bug description for foreign key constraint violation during root cause analysis pending. needs developer review. enhancement request,Database,Low,False,
174,Font rendering inconsistent across browsers.,Detailed bug description for font rendering inconsistent across browsers. root cause pending. needs developer review. related issue with cosmetic issue,UI,Low,True,1851.0
1561,Lag noticed when scrolling through tables.,Detailed bug description lag noticed when through large data tables. root cause analysis pending. needs developer review. minor ui glitch,Performance,Low,True,1038.0
871,Backup restore failed to missing wal logs.,Detailed bug description backup restore failed due to missing wal logs. root cause analysis pending. needs developer review. partial outage,Database,Medium,True,1293.0
877,Primary key conflict inserting duplicate record.,Detailed bug description for primary key conflict when inserting duplicate record. cause analysis pending. needs developer review. non-blocking bug,Database,Low,True,271.0
239,Icons missing after ui theme update.,Detailed description for icons missing after ui theme update. root cause analysis pending. needs developer review. cosmetic issue,UI,Low,False,
