bug_id,summary,description,category,priority,is_duplicate,duplicate_bug_id
140,Color too low for accessibility compliance.,Detailed bug description for color contrast low for accessibility compliance. root cause analysis pending. needs developer review. fix,UI,High,True,1617.0
1979,File endpoint allows arbitrary file types.,Bug description for file upload endpoint allows arbitrary file types. root cause pending. needs developer review. urgent fix,Security,High,True,1692.0
880,Database connection pool exhausted during peak,Detailed bug description database connection pool exhausted during peak traffic. root cause analysis pending. needs developer cosmetic issue,Database,Low,True,1276.0
662,Cache not invalidating after record update.,Detailed bug description for not invalidating after record update. root cause analysis pending. needs review. intermittent error,Backend,Medium,True,1893.0
100,Text overflow issue on mobile devices.,Detailed bug for text overflow issue on mobile devices. root cause analysis pending. needs developer review. related issue api non-blocking bug,UI,Low,True,1060.0
1311,Inefficient algorithm causing long response time.,Bug description for inefficient algorithm causing long response time. root analysis pending. needs developer review. related issue with crash moderate issue,Performance,Medium,False,
557,Api returning 500 internal server on post request.,Detailed bug for api 500 internal server error on post request. root cause analysis pending. needs developer review. non-blocking bug,Backend,Low,False,
281,Not appearing on hover for,Detailed bug description for tooltip not appearing on hover for icons. root cause analysis pending. developer review. intermittent error,UI,Medium,False,
89,Button alignment broken on dashboard page.,Detailed bug description for button alignment broken on dashboard page. root cause analysis pending. needs developer review. non-blocking,UI,Low,True,1642.0
437,Background job stuck in state indefinitely.,Detailed bug description for background job stuck in pending state indefinitely. root cause analysis pending. needs developer partial outage,Backend,Medium,True,279.0
1086,Migration script failing on production schema.,Bug description for migration script failing on production schema. root cause analysis pending. needs developer review. enhancement request,Database,Low,True,275.0
513,Payment service returning invalid response structure.,Detailed bug description for payment service returning invalid response structure. root cause analysis pending. needs review. issue with query intermittent error,Backend,Medium,False,
1163,Migration script failing on production schema.,Detailed bug description for migration script failing on production root cause analysis pending. needs developer review. urgent fix,Database,High,False,
1074,Query execution taking than on large dataset.,Detailed bug description for query taking longer than expected on large dataset. root cause analysis pending. needs developer review. moderate issue,Database,Medium,True,236.0
228,Color contrast too for accessibility compliance.,Detailed bug for color contrast too low for compliance. root cause analysis pending. needs developer review. moderate issue,UI,Medium,True,1557.0
1541,Excessive network calls during dashboard rendering.,Detailed bug description excessive network calls during dashboard rendering. root cause analysis pending. needs developer review. related issue with memory request,Performance,Low,True,1113.0
860,Deadlock detected while committing transaction.,Detailed bug description for deadlock detected while committing transaction. cause analysis needs developer review. temporary failure,UI,Medium,True,1166.0
621,Null exception in user service layer.,Detailed bug description for null pointer exception user service layer. cause analysis pending. needs developer review. urgent fix,Backend,High,True,799.0
1206,Inefficient algorithm causing long response time.,Detailed bug description for inefficient algorithm long response time. root cause analysis pending. needs developer review. critical failure,Performance,High,True,1427.0
1061,Data error to column length mismatch.,Bug description for data truncation error due column length mismatch. root cause analysis pending. needs developer review. moderate issue,Database,Medium,True,1257.0
1388,Excessive network calls during dashboard rendering.,Detailed bug description excessive network calls during dashboard rendering. root cause analysis pending. needs developer enhancement request,Performance,Low,True,1839.0
75,Scroll not visible in page.,Detailed bug description for scroll bar not visible in page. root cause analysis pending. needs developer critical failure,UI,High,True,217.0
1582,Slow response time on checkout endpoint.,Bug description for slow response time on checkout endpoint. root cause analysis pending. needs developer review. related issue with crash security breach,Performance,High,True,252.0
658,Api 500 internal server error on post request.,Detailed bug description for api returning 500 internal server error on post request. cause analysis pending. needs developer review. partial outage,Backend,Medium,True,1189.0
734,Timeout error while processing batch job.,Detailed description for timeout error processing batch job. root cause analysis pending. needs developer review. moderate issue,Backend,Medium,True,1909.0
1780,Cors exposes to external domains.,Detailed bug for cors misconfiguration exposes api to external domains. root cause analysis pending. needs developer review. partial outage,Security,Medium,True,637.0
73,Color contrast too low for compliance.,Detailed bug description for contrast too low for accessibility compliance. root cause analysis pending. needs developer review. temporary failure,UI,Medium,True,980.0
338,Font rendering inconsistent across browsers.,Detailed description for font rendering inconsistent across browsers. root cause analysis pending. needs developer review. temporary failure,UI,Medium,True,1045.0
308,Button alignment broken on dashboard page.,Detailed description for button alignment broken on dashboard page. cause analysis pending. needs developer review. related issue with error system crash,UI,High,True,1906.0
1634,Control missing admin dashboard route.,Detailed bug description for access control missing for admin dashboard route. cause analysis pending. needs developer review. related issue with memory security breach,Security,High,True,1066.0
714,Incorrect json serialization in api output.,Detailed bug description for incorrect json serialization in api output. root cause analysis needs developer review. minor ui,Backend,Low,False,
1088,Backup failed due to missing wal logs.,Detailed bug description for backup restore due to missing wal logs. root cause analysis pending. needs developer review. moderate issue,Database,Medium,True,1377.0
1554,Memory leak detected file upload,Detailed bug description for memory leak detected during file upload process. cause pending. needs developer review. moderate issue,Performance,Medium,True,67.0
1319,Page load exceeds 10 seconds on listing page.,Detailed bug description for page load time exceeds 10 seconds on listing page. root cause analysis pending. needs developer review. related issue with login system crash,Performance,High,False,
1428,Slow response time on checkout endpoint.,Detailed bug description for slow response time checkout endpoint. root cause analysis pending. needs developer review. crash,Performance,High,True,1670.0
676,Email notification queue processing due to dependency.,Detailed bug description email notification queue processing failed due to missing dependency. root cause analysis pending. needs review. minor ui glitch,Backend,Low,True,1733.0
209,Modal popup not centered in viewport.,Detailed description for modal popup not centered in viewport. root cause analysis pending. needs review. critical failure,UI,Medium,True,961.0
1316,Leak detected during file upload process.,Detailed bug description for memory leak detected file upload process. root cause analysis pending. needs developer review. related issue with query system crash,Performance,High,True,653.0
1092,Backup restore failed due to missing wal,Detailed description for backup restore failed due to missing wal logs. root cause pending. needs developer review. system crash,Database,High,True,57.0
817,Query execution taking longer on large dataset.,Detailed bug description for query taking longer than expected on large dataset. root cause analysis pending. needs developer review. critical failure,Database,High,True,1159.0
1751,Control missing for admin dashboard route.,Detailed bug description for access control missing for admin dashboard route. root cause analysis pending. needs developer review. related issue timeout security breach,Security,High,True,1557.0
517,Email notification queue processing due missing dependency.,Detailed bug description for email queue processing failed due to missing dependency. root cause analysis pending. needs developer review. moderate issue,Backend,Medium,True,895.0
887,Foreign key constraint violation during insert,Detailed bug description for foreign key constraint violation during insert operation. root analysis pending. developer review. partial outage,Database,Low,True,1487.0
1817,Sql injection vulnerability found login endpoint.,Detailed bug description for sql vulnerability found in login endpoint. root cause analysis needs developer review. critical failure,Security,High,False,
739,Api returning 500 internal server error post request.,Detailed bug description for api returning 500 internal server error post request. root cause analysis pending. needs developer review. security breach,Backend,High,True,915.0
1437,Memory leak detected file upload process.,Detailed bug description for memory leak detected file upload process. root cause analysis pending. needs developer review. urgent fix,Performance,High,True,1199.0
435,Timeout error while processing batch job.,Detailed bug for timeout error while processing batch job. root cause analysis pending. needs developer review. outage,Backend,Medium,True,1536.0
1504,Memory leak during file upload,Detailed bug description for memory leak detected during file upload root cause analysis needs developer review. related issue with query moderate issue,Performance,Medium,True,1956.0
1973,User not invalidated logout event.,Detailed bug description for user session not invalidated after event. root cause analysis pending. needs developer review. critical failure,Security,High,True,25.0
1025,Transaction rollback triggered by trigger mismatch.,Detailed bug for transaction rollback by trigger mismatch. root cause analysis pending. needs developer review. intermittent error,Database,Medium,True,502.0
586,Authentication token validation failed intermittently.,Detailed bug for token validation failed intermittently. root cause analysis pending. needs developer review. temporary failure,Backend,Medium,True,750.0
340,Modal popup not centered in viewport.,Detailed bug description for modal popup not centered in viewport. root analysis pending. needs developer review. related issue with crash moderate issue,UI,Medium,True,1057.0
455,Timeout error while processing batch job.,Detailed bug description for timeout error while processing batch job. root cause analysis pending. developer review. related issue with login intermittent error,Backend,Medium,True,332.0
635,Null pointer in service layer.,Detailed bug description for null pointer exception in user service layer. root cause analysis needs developer review. related issue with query system crash,Backend,High,False,
1662,Cross-site scripting issue comments section.,Detailed bug description for cross-site scripting (xss) issue in comments section. root cause analysis pending. developer review. security,Security,High,True,1472.0
1438,Inefficient algorithm causing long response time.,Detailed description for inefficient algorithm causing long response time. root cause analysis pending. needs review. cosmetic issue,Performance,Low,True,893.0
527,Data inconsistency order service response.,Detailed bug description for data inconsistency found in order service cause analysis pending. needs developer review. partial outage,Backend,Medium,True,1300.0
1167,Foreign key violation during insert operation.,Detailed bug description for foreign key constraint violation during insert operation. root cause analysis pending. needs developer review. related issue with outage,Database,Medium,False,
736,Authentication token validation failed intermittently.,Detailed bug description token validation failed intermittently. root cause analysis pending. needs developer review. cosmetic issue,Backend,Low,True,300.0
1809,Cross-site scripting (xss) issue in section.,Detailed bug description for scripting (xss) issue in comments section. root cause analysis pending. developer review. cosmetic issue,Security,Low,False,
152,Tooltip not appearing for icons.,Detailed bug description for tooltip not appearing on hover for icons. root analysis needs developer review. system crash,UI,High,True,1857.0
1715,Insecure http instead of https for api calls.,Detailed bug description for insecure http used instead of https for api calls. root cause analysis needs developer review. related issue with error moderate issue,Security,Medium,True,513.0
7,Appearing on hover for icons.,Detailed bug description for tooltip not appearing on for icons. root cause analysis pending. needs developer review. minor ui glitch,UI,Low,True,1612.0
1114,Query execution taking longer than expected on large,Detailed bug description for query execution taking longer than expected on large dataset. cause analysis pending. needs developer review. related issue with query urgent fix,Database,High,True,40.0
1521,Thread contention causing processing delays.,Detailed bug description for thread contention causing processing delays. root cause analysis pending. needs developer review. related issue with error security,Performance,High,True,355.0
1444,Excessive network calls during dashboard rendering.,Detailed bug description excessive network calls during dashboard rendering. root cause analysis pending. needs developer review. minor ui glitch,Database,Low,True,1060.0
1806,(xss) issue in comments section.,Description for cross-site scripting (xss) issue in comments section. root cause analysis pending. needs developer review. moderate issue,Security,Medium,False,
700,Cache not invalidating after record update.,Detailed bug description for not invalidating after record update. root cause analysis pending. needs developer review. temporary failure,Backend,Medium,True,511.0
472,Data found in order response.,Detailed bug description for data inconsistency found in order service root analysis pending. needs developer review. related issue with timeout cosmetic issue,Backend,Low,True,1421.0
1907,Insecure http used of https for calls.,Detailed bug description for insecure http used instead of https for api calls. root cause analysis pending. needs developer review. failure,Security,High,False,
1256,Excessive network calls during dashboard rendering.,Detailed bug description for excessive network calls during dashboard rendering. root cause pending. needs developer review. enhancement request,Performance,Low,True,847.0
498,Cache not invalidating after record update.,Detailed bug for cache not invalidating after record update. root cause analysis needs developer review. non-blocking bug,Backend,Low,True,276.0
291,Scroll bar not visible settings,Detailed bug description for scroll bar not visible in settings page. cause analysis pending. needs developer review. related issue with error minor ui glitch,Security,Low,True,554.0
1254,Degradation observed after caching layer update.,Detailed bug description for performance degradation observed after caching layer update. root cause analysis pending. needs review. critical failure,UI,High,True,1383.0
465,Data inconsistency found in order,Detailed bug description for data inconsistency found in order service response. root cause analysis pending. developer review. cosmetic issue,Backend,Low,False,
1607,Jwt tokens not expiring inactivity period.,Detailed bug description jwt tokens not expiring after inactivity root cause analysis pending. needs developer review. related issue with timeout security breach,UI,High,False,
1626,Insecure http used instead https for calls.,Detailed bug description for insecure http used instead of https for api calls. root cause analysis pending. developer review. moderate issue,Security,Low,True,1490.0
669,Payment service returning invalid response structure.,Detailed bug description payment service returning invalid response structure. root cause analysis pending. needs developer review. enhancement request,Backend,Low,True,1249.0
1707,Injection vulnerability found login endpoint.,Bug description for sql injection vulnerability found in login endpoint. root cause analysis needs developer review. urgent fix,Security,High,True,1261.0
403,Incorrect json serialization in api output.,Detailed bug for incorrect json serialization in api output. cause analysis pending. needs developer review. related issue with memory urgent fix,Database,High,True,1929.0
251,Tooltip not appearing on hover for,Detailed bug description for tooltip not on hover for icons. root cause analysis pending. needs review. critical failure,UI,High,False,
728,Background stuck in pending state indefinitely.,Detailed description for background job stuck in pending state indefinitely. root cause analysis pending. needs review. related issue with crash system crash,Backend,High,True,779.0
1155,Query taking longer expected on large dataset.,Detailed bug description for query execution taking longer than expected on dataset. root cause analysis pending. needs developer review. fix,Database,High,True,480.0
1663,File upload endpoint allows arbitrary types.,Detailed bug description for file upload endpoint arbitrary file types. root cause analysis pending. needs developer review. related issue performance security breach,Security,High,True,295.0
1785,Jwt tokens not expiring after inactivity,Detailed bug description for jwt tokens not expiring after inactivity root cause analysis pending. needs developer review. moderate issue,Security,Medium,True,1437.0
461,Payment service returning invalid response structure.,Detailed bug description payment service returning invalid response structure. root analysis pending. needs developer review. related issue with login minor ui glitch,Database,Low,True,1596.0
1874,Access control for admin dashboard route.,Bug description for access control missing for admin dashboard route. root cause analysis pending. needs developer review. urgent fix,Security,High,True,1660.0
1754,Tokens not expiring after period.,Detailed bug description for jwt tokens not expiring after inactivity period. root cause analysis pending. developer review. issue with crash intermittent error,Security,Medium,True,1567.0
1814,File upload endpoint arbitrary file types.,Detailed bug for file upload endpoint arbitrary file types. root cause analysis pending. needs developer review. critical failure,Security,High,True,1532.0
1622,Sensitive data exposed in api payload.,Detailed bug description for sensitive data exposed in api response payload. root cause pending. needs review. temporary failure,Security,Medium,False,
994,Deadlock detected while committing transaction.,Detailed for deadlock detected while committing transaction. root cause analysis pending. needs developer review. system crash,Database,High,True,441.0
1398,Memory leak detected file upload process.,Detailed bug description for memory leak detected during file upload process. root cause pending. needs developer review. related issue with error moderate issue,Performance,Medium,True,833.0
1850,Tokens not expiring after inactivity period.,Detailed bug for jwt tokens not expiring after inactivity period. root cause analysis pending. needs developer related issue with performance moderate issue,Security,Medium,True,944.0
582,Incorrect json serialization in api output.,Detailed bug description for json serialization in api output. root cause analysis pending. needs developer review. temporary failure,Backend,Medium,False,
1548,Performance degradation observed after caching update.,Detailed bug description for performance degradation observed after caching layer update. root cause analysis pending. needs developer review. issue with timeout enhancement request,Performance,Low,True,1820.0
79,Font rendering inconsistent across browsers.,Detailed bug description for font rendering inconsistent across browsers. cause analysis pending. developer review. related issue with timeout moderate issue,UI,Medium,True,290.0
447,Incorrect json serialization in api output.,Detailed bug description for incorrect json serialization in api output. cause analysis pending. needs developer review. related issue performance intermittent error,Backend,Medium,True,1978.0
625,Timeout error while processing batch job.,Detailed bug description for while processing batch job. root cause analysis pending. needs developer review. urgent fix,Database,High,True,589.0
949,Foreign key during insert operation.,Detailed bug description for foreign key constraint violation during insert operation. root cause analysis pending. needs developer review. moderate,UI,Medium,False,
1292,Client-side rendering takes too long heavy elements.,Detailed bug description for client-side rendering takes too long under heavy dom elements. root cause analysis needs developer review. related issue with api cosmetic issue,Performance,Low,True,1683.0
1177,Connection exhausted during peak traffic.,Detailed bug description for database pool exhausted during peak traffic. root cause analysis pending. needs developer review. related issue with performance system,Database,High,True,1237.0
1711,Access control missing admin route.,Detailed bug description for access control missing for dashboard route. root cause analysis pending. needs developer review. related issue with api critical failure,Security,High,True,1517.0
1026,Migration script failing on production schema.,Detailed bug description for migration script failing on production schema. root cause analysis pending. needs developer review. related issue with failure,Database,Medium,True,1075.0
1705,Cors misconfiguration api to external domains.,Detailed bug for cors misconfiguration exposes api to external domains. root cause analysis pending. developer review. urgent fix,Security,High,False,
1713,Jwt tokens expiring inactivity period.,Detailed bug description for jwt tokens expiring inactivity period. root cause analysis pending. needs developer review. related issue with api enhancement request,Security,Low,True,1880.0
1748,Cors misconfiguration api to domains.,Detailed bug description for cors misconfiguration api to external domains. root cause analysis pending. needs developer review. cosmetic issue,Security,Low,True,1980.0
475,Authentication token validation failed intermittently.,Detailed bug description for authentication token validation failed intermittently. root cause analysis pending. needs review. minor ui glitch,Backend,Low,True,1084.0
444,Payment service returning invalid response structure.,Detailed bug description for payment service returning invalid response root cause analysis pending. needs developer review. related issue with security breach,Backend,Medium,True,1198.0
543,Authentication token validation failed intermittently.,Detailed bug description authentication token validation failed intermittently. root cause analysis pending. needs developer review. minor glitch,Backend,Low,True,398.0
737,Authentication token validation failed intermittently.,Detailed bug description for authentication token failed intermittently. root cause analysis pending. needs developer intermittent error,Performance,Medium,True,217.0
481,Timeout error while processing batch job.,Detailed bug description for timeout error while processing batch job. root cause analysis pending. developer review. security breach,Backend,High,True,1009.0
33,Modal popup not centered in viewport.,Detailed bug description for modal popup not centered in root cause analysis pending. needs developer review. system crash,UI,Low,True,166.0
1228,Page load time exceeds 10 seconds on listing page.,Detailed bug description for page load time exceeds 10 seconds on product page. root cause analysis pending. needs developer review. related issue with cosmetic issue,Performance,Low,True,516.0
1813,Scripting (xss) issue in comments section.,Detailed description for cross-site scripting (xss) issue in comments section. root cause analysis pending. needs developer review. urgent fix,Security,High,True,1371.0
1214,Inefficient algorithm causing long response time.,Detailed bug description for inefficient algorithm causing long response time. root cause analysis pending. developer review. related issue with performance temporary failure,Performance,Medium,True,1319.0
1581,Page load time exceeds 10 on product listing page.,Detailed bug description for page load time exceeds 10 seconds on product page. root cause analysis pending. needs developer review. system crash,UI,High,True,1668.0
26,Scroll bar not in page.,Detailed bug description for scroll bar not visible in settings page. root analysis pending. needs developer review. critical failure,UI,High,True,625.0
1714,Cross-site (xss) issue in comments,Detailed description for cross-site (xss) issue in comments section. root cause analysis pending. needs developer review. related issue with crash non-blocking bug,Performance,Low,True,1837.0
1119,Database pool exhausted during peak,Detailed bug description for database pool exhausted during peak traffic. root cause analysis pending. needs developer review. non-blocking bug,Database,Low,True,1564.0
