bug_id,summary,description,category,priority,is_duplicate,duplicate_bug_id
1880,Access control missing for dashboard route.,Detailed bug description access control missing for admin route. root cause analysis pending. needs developer review. urgent fix,Security,High,False,
88,Font rendering inconsistent across browsers.,Detailed bug description for font rendering inconsistent across browsers. root cause pending. needs developer review. enhancement request,UI,Low,True,259.0
117,Icons missing after ui theme update.,Detailed bug for icons missing after ui theme update. root cause analysis pending. needs developer review. moderate issue,UI,Medium,True,1463.0
49,Icons missing after ui theme update.,Detailed bug description icons missing after ui theme update. root cause analysis pending. developer review. related issue with query security breach,Database,Low,True,1772.0
47,Button alignment broken on dashboard page.,Detailed bug for button alignment broken on dashboard page. root cause pending. needs developer review. critical failure,UI,High,True,1410.0
900,Transaction rollback triggered by trigger mismatch.,Detailed bug description for transaction rollback triggered by trigger mismatch. root cause pending. needs developer review. non-blocking bug,Database,Low,False,
488,Timeout error while processing batch job.,Detailed bug description for timeout error while processing root cause analysis pending. needs developer review. related issue with ui enhancement request,Backend,Low,False,
233,Button alignment broken on dashboard page.,Detailed bug description for button alignment broken on dashboard page. root analysis needs developer review. related issue with memory security breach,UI,High,True,1572.0
293,Images stretched in gallery grid layout.,Detailed bug description for images stretched in gallery layout. root cause analysis pending. needs developer review. partial outage,UI,Medium,True,183.0
128,Bar not visible in settings page.,Detailed bug for scroll bar not in settings page. root cause analysis pending. needs developer review. related issue with ui partial outage,UI,Medium,False,
1355,Performance degradation after caching update.,Bug for performance degradation observed after caching layer update. root cause analysis pending. needs developer review. system crash,Performance,High,True,370.0
597,Authentication token validation failed intermittently.,Detailed bug description for authentication token validation failed intermittently. root analysis pending. needs developer review. related issue with response temporary failure,Backend,Medium,True,1062.0
262,Scroll bar not in page.,Detailed bug description for scroll bar not visible in page. root cause analysis pending. needs developer review. related issue with memory enhancement request,UI,Low,False,
451,Inconsistency found in service response.,Detailed bug description for data inconsistency found in order service response. root cause analysis pending. needs developer critical,Backend,High,True,1397.0
238,Text overflow issue on mobile devices.,Bug description for text overflow issue on mobile devices. root cause analysis pending. needs developer review. urgent fix,UI,High,True,655.0
287,Scroll bar in settings page.,Detailed bug description for scroll bar not visible in page. root cause analysis pending. needs developer intermittent error,UI,Medium,True,1931.0
884,Key constraint violation during insert operation.,Bug description for foreign key constraint violation during insert operation. root cause pending. needs developer review. security breach,Database,High,False,
1364,High cpu utilization during analytics computation.,Detailed bug description for high cpu utilization analytics computation. root cause analysis pending. needs developer review. non-blocking bug,Performance,Low,True,908.0
666,Job stuck in pending state indefinitely.,Detailed bug description for background job stuck in pending state root cause analysis pending. needs developer review. cosmetic issue,Backend,Low,True,1073.0
173,Icons missing after ui theme update.,Detailed bug description for icons missing after ui theme update. root cause pending. needs developer review. partial outage,UI,Medium,True,750.0
1668,Cors exposes api external domains.,Detailed bug description for cors misconfiguration exposes api to external domains. cause analysis pending. needs developer review. related issue with response minor ui glitch,Security,Low,True,1076.0
1327,Client-side rendering takes too long under dom elements.,Detailed bug description for client-side rendering takes too long heavy dom elements. root cause analysis pending. needs developer review. issue with crash critical failure,Performance,High,True,1938.0
510,Timeout error while processing batch job.,Detailed bug description for timeout error while processing batch job. root cause pending. needs review. security breach,Performance,High,True,617.0
1655,Cross-site scripting (xss) issue in comments,Detailed bug description for cross-site scripting (xss) in comments section. root cause analysis pending. needs developer review. partial outage,Security,Medium,True,541.0
998,Data truncation error due column length mismatch.,Detailed bug description data truncation error due to column length mismatch. root cause analysis pending. needs developer review. temporary failure,Database,Medium,True,1588.0
1654,Jwt tokens not expiring after period.,Bug description for jwt tokens not expiring after inactivity period. root cause analysis pending. developer review. temporary failure,Security,Medium,True,509.0
1900,Sql injection found in login endpoint.,Detailed bug description for injection vulnerability found in login endpoint. root cause analysis pending. needs developer review. temporary failure,Security,Medium,True,362.0
1688,File upload endpoint allows file types.,Detailed bug for file upload endpoint allows arbitrary file types. root cause analysis pending. needs developer review. related issue with query temporary failure,Security,Medium,True,1897.0
1110,Restore failed due to wal logs.,Detailed bug description for backup restore failed due to missing wal logs. root analysis pending. needs developer review. critical failure,Database,High,True,790.0
941,Transaction rollback triggered by trigger mismatch.,Detailed bug description for transaction rollback triggered by mismatch. root cause analysis needs developer review. critical failure,Database,High,True,1343.0
1811,Jwt not expiring inactivity period.,Detailed bug description for jwt tokens not expiring after inactivity period. root cause analysis pending. needs developer review. related issue api system crash,Security,High,False,
1321,Page load time exceeds 10 on listing page.,Detailed bug description for page load time exceeds 10 seconds on product listing page. root analysis pending. needs developer related issue with query temporary failure,Performance,Medium,True,1781.0
1945,File upload endpoint allows arbitrary file,Detailed bug description for file upload allows arbitrary file types. root cause analysis pending. needs developer review. moderate issue,Security,High,True,610.0
422,Authentication token validation failed intermittently.,Detailed description for authentication token validation intermittently. root cause analysis pending. needs developer review. related issue with login minor ui glitch,Backend,Low,True,1966.0
229,Tooltip not appearing on hover icons.,Detailed bug description for tooltip not appearing on hover for icons. root cause analysis pending. needs review. critical failure,UI,High,True,841.0
726,Email processing failed due to missing dependency.,Detailed bug description for email notification processing failed due to missing dependency. root cause analysis needs developer review. enhancement request,Backend,Low,False,
1081,Backup restore failed to missing wal,Bug description for backup restore failed due to missing wal logs. root cause analysis pending. needs review. related issue with api critical failure,Database,Low,True,180.0
891,Deadlock detected while committing transaction.,Detailed bug description for deadlock detected while committing transaction. root cause analysis pending. needs developer review. issue with login error,Database,Medium,True,1439.0
325,Text overflow issue on mobile devices.,Detailed bug description for text overflow issue on devices. root cause analysis needs developer review. related issue with memory security breach,UI,High,True,717.0
1839,Cross-site scripting (xss) issue in section.,Bug description for cross-site scripting (xss) issue in comments section. root cause analysis pending. needs developer review. cosmetic issue,Security,Low,False,
1039,Migration script failing on production schema.,Detailed description for migration script failing on production schema. root cause analysis pending. needs developer review. cosmetic issue,Database,High,True,1578.0
639,Null pointer exception service layer.,Detailed bug description for null pointer exception in user service layer. root cause analysis pending. needs developer moderate issue,Security,High,True,1908.0
960,Data error due column length mismatch.,Detailed bug description for data truncation error due to column length mismatch. root cause pending. needs developer review. intermittent error,Database,Medium,True,1728.0
1283,Client-side rendering takes too long under heavy dom,Detailed bug description for client-side takes too long under heavy dom elements. root cause analysis pending. developer review. related issue with ui partial outage,Performance,Medium,True,951.0
703,Email notification processing failed due to dependency.,Detailed bug description for email notification queue processing due to missing dependency. root cause analysis pending. needs developer review. moderate issue,Backend,Medium,True,496.0
1887,Sql injection found in login endpoint.,Detailed bug description for sql injection vulnerability found in login endpoint. root analysis pending. needs developer review. urgent fix,Security,High,True,1062.0
773,Authentication token validation failed intermittently.,Detailed bug description authentication token validation failed intermittently. root cause analysis needs developer review. related issue with memory moderate issue,Backend,High,True,1267.0
968,Data truncation error due to column mismatch.,Detailed bug description for data truncation error to column length mismatch. root cause analysis pending. needs developer non-blocking bug,UI,Low,True,1585.0
1752,Weak password policy allows insecure credentials.,Detailed bug description for weak password policy insecure credentials. root cause analysis pending. needs developer review. partial outage,UI,Medium,True,900.0
1941,Jwt tokens not inactivity period.,Detailed bug for jwt tokens not expiring after inactivity period. root cause analysis pending. needs developer review. partial outage,Security,Medium,True,842.0
983,Migration script failing on production schema.,Detailed bug description for migration script failing on production schema. cause analysis pending. needs developer review. security breach,Database,High,True,1198.0
294,Scroll not visible in settings page.,Detailed bug description for scroll bar visible in settings page. root cause analysis pending. needs developer review. system crash,Backend,High,True,1133.0
1443,Performance degradation observed after caching update.,Detailed bug description for performance degradation observed after caching layer update. root cause analysis pending. needs developer review. minor ui,Performance,Low,True,536.0
1432,Excessive network calls during dashboard rendering.,Detailed description for excessive network calls during dashboard rendering. root cause analysis pending. needs developer review. moderate issue,Performance,Medium,True,275.0
111,Modal popup not centered in viewport.,Detailed bug description for modal popup not centered in viewport. root analysis pending. needs developer review. related issue with memory system crash,UI,High,True,1910.0
190,Button alignment broken on dashboard page.,Detailed bug description for button alignment broken on dashboard page. root cause analysis pending. needs developer intermittent error,UI,Medium,True,1453.0
1203,High cpu utilization during analytics computation.,Detailed bug description for cpu utilization during analytics computation. cause analysis pending. needs developer review. urgent fix,Performance,High,True,1057.0
1855,Weak password policy allows insecure credentials.,Bug description for weak password policy allows credentials. root cause analysis pending. needs developer review. related issue with crash intermittent error,Security,Medium,True,1032.0
234,Font rendering inconsistent across browsers.,Detailed description for rendering inconsistent across browsers. root cause analysis pending. needs developer review. minor ui glitch,UI,Low,True,1047.0
501,Api 500 internal error on post request.,Detailed bug description for api returning 500 internal server error on post request. root analysis pending. developer review. partial outage,Backend,Medium,True,375.0
820,Transaction rollback triggered by trigger mismatch.,Detailed description for transaction rollback triggered by trigger mismatch. root cause analysis pending. needs developer review. cosmetic,Database,Low,True,475.0
1775,Sql injection vulnerability in login endpoint.,Detailed bug description for sql injection vulnerability found in endpoint. root cause analysis pending. needs developer review. breach,Backend,High,True,1141.0
1426,Thread contention causing processing delays.,Detailed bug description for thread contention causing processing delays. root cause analysis pending. needs developer review. related issue ui system crash,Performance,High,True,666.0
1777,Tokens not expiring after inactivity period.,Detailed bug description for jwt tokens not expiring after inactivity period. analysis pending. needs developer review. intermittent error,Security,Medium,True,570.0
1718,Jwt tokens not expiring after period.,Bug description for jwt tokens not expiring after period. root cause analysis pending. needs developer review. partial outage,UI,Medium,True,348.0
1873,Http used instead of https for api calls.,Detailed bug description insecure http used instead of https for api calls. root cause analysis pending. needs developer partial outage,Security,Medium,True,554.0
848,Data truncation error due column length mismatch.,Detailed bug description for data truncation error due to column length mismatch. root cause analysis needs developer review. minor ui glitch,Database,Low,True,1567.0
327,Modal popup not centered in viewport.,Detailed bug for modal popup not centered in viewport. root cause analysis pending. needs developer review. moderate issue,UI,Medium,True,1118.0
200,Modal popup not centered in viewport.,Detailed bug description for modal popup not centered in viewport. root cause analysis pending. needs developer review. related with timeout urgent fix,UI,High,True,1888.0
443,Payment service returning invalid response structure.,Bug description for payment service returning invalid response structure. root cause analysis pending. needs review. urgent fix,Backend,High,True,721.0
1120,Data truncation error due to column mismatch.,Detailed bug for truncation error due to column length mismatch. root cause analysis pending. needs developer review. related issue with ui non-blocking bug,Database,Low,True,1976.0
1605,Cors misconfiguration exposes api to domains.,Detailed bug description for cors misconfiguration exposes api to domains. root cause analysis pending. needs developer review. intermittent error,Security,Medium,True,1369.0
460,Incorrect json serialization in api output.,Detailed bug description for incorrect json serialization api output. root cause analysis pending. developer review. critical failure,Backend,High,True,120.0
1359,Slow response time on checkout endpoint.,Detailed description for slow response time on checkout endpoint. root analysis pending. needs developer review. critical failure,Performance,High,False,
1931,Weak password policy allows insecure credentials.,Detailed bug description for weak password policy allows insecure credentials. cause analysis pending. needs developer review. minor ui glitch,Security,Low,True,987.0
589,Background stuck pending state indefinitely.,Detailed description for background job stuck in pending state indefinitely. cause analysis pending. needs developer review. moderate issue,Backend,Medium,True,467.0
1969,Upload endpoint allows arbitrary file types.,Detailed bug description for file upload endpoint allows arbitrary file types. root cause analysis pending. needs developer related issue with crash urgent fix,Security,High,True,1702.0
187,Scroll not visible in settings page.,Detailed bug description for scroll bar not in settings page. root cause analysis pending. needs developer temporary failure,UI,Medium,True,941.0
155,Tooltip not on hover for icons.,Detailed description for tooltip not appearing on hover for icons. root cause analysis pending. needs developer review. partial outage,UI,Medium,True,515.0
1539,Memory leak detected during upload,Detailed bug description for memory leak detected during file upload process. root analysis pending. needs developer review. minor ui glitch,Performance,Low,True,548.0
1737,Sql vulnerability found in login,Detailed bug description for injection vulnerability found in login endpoint. root cause analysis pending. needs developer review. related issue with login temporary failure,Security,Medium,True,1673.0
632,Payment service returning invalid response structure.,Detailed bug description payment service returning invalid response root cause analysis pending. needs developer review. temporary failure,Backend,Medium,True,1140.0
1085,Primary key conflict inserting duplicate,Bug description for primary key conflict when inserting duplicate record. root cause analysis pending. needs developer review. related with memory system crash,Database,High,False,
567,Authentication token validation failed intermittently.,Detailed bug description for authentication token validation failed intermittently. root cause analysis pending. needs developer related issue with crash moderate issue,Performance,Medium,True,760.0
1849,Insecure http of https for api calls.,Detailed bug description for insecure http used instead of https for calls. root cause analysis pending. needs developer review. related issue with response enhancement request,Database,High,True,634.0
1130,Query execution longer than expected on dataset.,Detailed description for query execution taking longer than expected on large dataset. root cause analysis pending. needs developer review. related issue with crash temporary failure,Database,Medium,True,710.0
402,Email notification queue processing failed due to,Detailed bug description for email notification queue processing failed due to missing dependency. root cause analysis needs developer review. critical failure,Backend,Low,True,1925.0
348,Button alignment broken on dashboard page.,Detailed bug description for button alignment broken on dashboard page. root cause analysis pending. needs developer review. request,Performance,Low,True,329.0
385,Tooltip not on hover for icons.,Detailed bug description for tooltip appearing on hover for icons. root cause analysis pending. needs developer review. non-blocking bug,UI,Low,True,943.0
211,Modal popup not centered in viewport.,Bug description for modal popup not centered in viewport. root cause analysis pending. needs developer review. related issue with performance security breach,UI,High,True,1325.0
944,Incorrect indexing causing slow query performance.,Detailed bug description for incorrect indexing causing slow query performance. root cause analysis pending. developer review. temporary failure,Performance,Medium,True,1489.0
1944,Jwt tokens not after inactivity period.,Detailed bug description jwt tokens not expiring after inactivity period. root cause analysis pending. developer review. system crash,Security,High,True,899.0
958,Migration script failing on production schema.,Detailed bug description for migration script failing on production schema. root cause analysis needs developer review. temporary failure,Database,Medium,True,404.0
1828,Session not after logout event.,Detailed bug description for user session not invalidated after logout event. root cause analysis pending. needs developer critical failure,Performance,High,True,1252.0
535,Timeout error while processing batch job.,Detailed bug description for timeout error while processing batch job. root cause analysis needs developer review. related issue with query temporary failure,UI,Medium,True,266.0
123,Images stretched in gallery grid layout.,Detailed bug description images stretched in gallery grid layout. root cause analysis pending. needs review. cosmetic issue,UI,Low,True,1143.0
78,Font rendering inconsistent across browsers.,Detailed bug description for font rendering inconsistent across browsers. root cause analysis pending. needs developer review. related issue with query outage,UI,Medium,True,1371.0
1069,Truncation error due to column length mismatch.,Bug description for data truncation error due to column length mismatch. root cause analysis pending. needs developer review. minor ui,Database,Low,True,1627.0
1459,Leak detected during file upload process.,Detailed bug description for memory leak detected during upload process. root cause analysis pending. needs developer review. temporary failure,Performance,Medium,True,1033.0
961,Deadlock detected while committing transaction.,Description for deadlock detected while committing transaction. root cause analysis pending. needs developer review. cosmetic issue,Database,Low,True,970.0
29,Font rendering inconsistent across browsers.,Detailed bug description for font rendering inconsistent across browsers. root analysis needs developer review. security breach,UI,Low,False,
701,Cache not invalidating after record update.,Detailed bug description for cache not invalidating after record update. root cause analysis pending. needs developer review. related issue with cosmetic issue,Backend,Medium,True,579.0
1409,Thread contention causing processing delays.,Detailed bug description for thread contention causing processing delays. cause analysis pending. needs review. security breach,Performance,High,True,1684.0
219,Modal popup not centered in viewport.,Detailed bug description for modal popup not centered in viewport. root cause analysis needs developer review. moderate issue,UI,Medium,True,1510.0
186,Dropdown menu overlaps footer section.,Detailed bug description for dropdown overlaps section. root cause analysis pending. needs developer review. minor ui glitch,UI,Low,True,1109.0
101,Icons missing after ui theme update.,Detailed bug description for icons missing after ui theme update. root cause analysis needs developer review. system crash,UI,High,True,144.0
66,Icons missing after ui theme update.,Detailed bug description for icons missing after theme update. root cause analysis pending. needs developer review. related issue with timeout minor ui glitch,UI,Low,False,
667,Cache not invalidating after record update.,Detailed bug description for cache not invalidating after record root cause analysis pending. needs developer review. urgent fix,Backend,High,True,875.0
1208,High cpu utilization during analytics computation.,Detailed bug description for high cpu utilization during analytics computation. cause analysis pending. needs developer review. related with performance cosmetic issue,Performance,Low,True,938.0
962,Truncation error due to column length mismatch.,Detailed bug description for data truncation error due column length mismatch. cause analysis pending. needs developer review. urgent fix,Database,High,True,596.0
112,Bar not visible in page.,Detailed bug description for scroll bar not visible in settings page. root cause analysis pending. needs developer review. related issue with crash enhancement,UI,Low,False,
1578,Lag noticed when scrolling through large,Detailed bug description for noticed when scrolling through large data tables. root cause analysis pending. needs developer review. related issue with api system crash,Performance,High,True,1426.0
205,Font rendering inconsistent across browsers.,Detailed bug description for font rendering inconsistent across browsers. root cause analysis pending. developer review. intermittent error,Backend,Medium,True,485.0
37,Scroll not in settings page.,Detailed bug description for scroll bar not visible in settings page. root analysis pending. needs developer review. related issue with api system crash,UI,High,False,
738,Data found in order service response.,Detailed bug description for data inconsistency found in order service root cause analysis pending. needs developer review. related issue with timeout moderate issue,Backend,Medium,True,123.0
1109,Migration script failing on production schema.,Detailed bug description for migration script on production schema. root cause analysis pending. needs developer review. intermittent error,Database,Medium,True,361.0
836,Query execution taking than expected on large dataset.,Detailed bug description for query execution taking longer than expected on large dataset. root cause analysis pending. needs developer review. issue with login cosmetic issue,Database,Low,True,552.0
1244,Excessive network calls during dashboard rendering.,Detailed bug description for excessive network calls during rendering. root cause analysis pending. needs review. critical failure,Performance,High,True,1300.0
1923,Insecure used instead of https api calls.,Detailed bug description for insecure http used of https for api calls. root cause analysis pending. needs developer review. related issue with performance critical failure,Security,High,False,
